{
  "plan_id": "EXP-0001",
  "candidate_id": "H-005",
  "plan_type": "baseline",
  "rationale": "Hourly BTCUSDT momentum was tested because MACD crossovers are a plausible momentum family, recent swing structure confirmation may filter false signals, and the 1h timeframe offered an active intraday layer with more observations than daily bars while avoiding the highest-turnover 15m/30m layers. RETROSPECTIVE: this plan was authored after execution as part of WP-6b to exercise the schema grammar. The original H-005 pre-registration lives in research/hypotheses/H-005/HYPOTHESIS.md and was not schema-validated at the time.",
  "hypothesis_to_test": "An hourly MACD crossover strategy with price-structure confirmation on BTCUSDT perpetuals will generate OOS Sharpe >= 1.0 net of modeled costs, capture directional momentum only when price confirms through recent structure, reduce false crossover exposure versus a MACD-only baseline, and survive walk-forward validation with efficiency > 0.5.",
  "success_criteria": {
    "gates": [
      "D2-006 promotion gates from docs/onboarding/PHASE2_BASELINE.md"
    ],
    "additional_criteria": [
      "OOS Sharpe >= 1.0 net of modeled costs",
      "Gate 2 passes under current evaluator semantics: dsr_val > 0.95 versus the expected maximum-SR benchmark from the registered trial count",
      "Max drawdown <= 20% in any walk-forward fold",
      "Parameter sensitivity: +/-25% parameter shift keeps Sharpe within 70% of baseline",
      "Cost drag <= 50% of gross PnL",
      "No single 90-day window contributes > 60% of total PnL",
      "Free parameters <= 5",
      "Walk-forward efficiency (OOS/IS Sharpe) > 0.5",
      "Kill criteria from H-005 HYPOTHESIS.md apply: OOS Sharpe < 0.3, max drawdown > 35%, cost drag > 50% of gross PnL, structure confirmation failure, or both long and short legs unprofitable"
    ]
  },
  "evaluation_window": {
    "in_sample": {
      "start": null,
      "end": null
    },
    "out_of_sample": {
      "start": null,
      "end": null
    }
  },
  "parameters": {
    "macd_fast": 12,
    "macd_slow": 26,
    "macd_signal": 9,
    "swing_lookback": 10,
    "risk_reward_ratio": 3,
    "taker_fee_bps": 4.0,
    "maker_fee_bps": 2.0,
    "slippage_bps": 2.0,
    "initial_equity": 10000.0,
    "execution": "next_bar_open",
    "primary_timeframe": "1h"
  },
  "data_requirements": [
    "1h OHLCV stream: ohlcv_1h",
    "BTCUSDT 1h full history: data/processed/binance_um_perp_BTCUSDT_1h_2020-01-01_2026-04-11_2026-04-12T1655Z.parquet",
    "BTCUSDT funding rates full history: data/processed/binance_um_perp_BTCUSDT_funding_8h_2019-09-10_2026-04-12_2026-04-12T1655Z.parquet",
    "No separate IS/OOS split convention existed in repo truth for this baseline; DEC-0005 records full-period Sharpe in both trial-log Sharpe fields"
  ],
  "pre_registration_date": "2026-04-15",
  "author": "WP-6b retrospective",
  "human_approval_required": false
}
