{
  "plan_id": "EXP-0006",
  "candidate_id": "H-006",
  "plan_type": "baseline",
  "rationale": "A 30m Bollinger Band squeeze breakout was tested because BTCUSDT volatility can cycle between contraction and expansion, and a post-squeeze close outside the bands may indicate emerging directional pressure. The squeeze filter was intended to keep this active intraday candidate more selective than a plain breakout. RETROSPECTIVE: this plan was authored after execution as part of WP-6c to extend the schema grammar to the remaining concluded candidates. The original H-006 pre-registration lives in research/hypotheses/H-006/HYPOTHESIS.md and was not schema-validated at the time.",
  "hypothesis_to_test": "A 30-minute Bollinger Band squeeze breakout strategy on BTCUSDT perpetuals will generate OOS Sharpe >= 1.0 net of modeled costs, capture directional expansion after volatility compression, keep turnover controlled enough that cost drag remains within D2-006 limits, and survive walk-forward validation with efficiency > 0.5.",
  "success_criteria": {
    "gates": [
      "D2-006 promotion gates from docs/onboarding/PHASE2_BASELINE.md"
    ],
    "additional_criteria": [
      "OOS Sharpe >= 1.0 net of modeled costs",
      "Gate 2 passes under current evaluator semantics: dsr_val > 0.95 versus the expected maximum-SR benchmark from the registered trial count",
      "Max drawdown <= 20% in any walk-forward fold",
      "Parameter sensitivity: +/-25% parameter shift keeps Sharpe within 70% of baseline",
      "Cost drag <= 50% of gross PnL",
      "No single 90-day window contributes > 60% of total PnL",
      "Free parameters <= 5",
      "Walk-forward efficiency (OOS/IS Sharpe) > 0.5",
      "Kill criteria from H-006 HYPOTHESIS.md apply: OOS Sharpe < 0.3, max drawdown > 35%, cost drag > 50% of gross PnL, squeeze selectivity failure, or time-stop dominated results"
    ]
  },
  "evaluation_window": {
    "in_sample": {
      "start": null,
      "end": null
    },
    "out_of_sample": {
      "start": null,
      "end": null
    }
  },
  "parameters": {
    "bb_period": 20,
    "bb_std_dev": 2.0,
    "squeeze_percentile": 20,
    "atr_multiplier": 1.5,
    "risk_reward_ratio": 2,
    "time_stop_bars": 20,
    "taker_fee_bps": 4.0,
    "maker_fee_bps": 2.0,
    "slippage_bps": 2.0,
    "initial_equity": 10000.0,
    "execution": "next_bar_open",
    "primary_timeframe": "30m"
  },
  "data_requirements": [
    "30m OHLCV stream: ohlcv_30m",
    "BTCUSDT 30m full history: data/processed/binance_um_perp_BTCUSDT_30m_2020-01-01_2026-04-11_2026-04-12T1655Z.parquet",
    "BTCUSDT funding rates full history supplied for funding cashflows: data/processed/binance_um_perp_BTCUSDT_funding_8h_2019-09-10_2026-04-12_2026-04-12T1655Z.parquet",
    "No separate IS/OOS split convention existed in repo truth for this baseline; DEC-0006 records full-period Sharpe in both trial-log Sharpe fields"
  ],
  "pre_registration_date": "2026-04-15",
  "author": "WP-6c retrospective",
  "human_approval_required": false
}
