{
  "plan_id": "EXP-0011",
  "candidate_id": "H-004",
  "plan_type": "baseline",
  "rationale": "Forward-flow re-execution of the already-known H-004 Daily Dual Moving Average with Volatility Regime Filter candidate under the current post-WP-5b measurement pipeline. This plan is authored before execution to prove that the going-forward Experiment Plan / Report contract can coexist with the historical retrospective H-004 artifacts EXP-0005 and REP-0005 without replacing, renaming, or reinterpreting them.",
  "hypothesis_to_test": "A daily 50/200 SMA crossover strategy with a realized-volatility regime filter on BTCUSDT perpetuals will generate OOS Sharpe >= 1.0 net of modeled costs, capture both bullish and bearish daily trend regimes when volatility is supportive, reduce low-quality crossover exposure by staying flat in low-volatility regimes, and survive the current promotion-gate evaluator under the post-WP-5b pipeline.",
  "success_criteria": {
    "gates": [
      "D2-006 promotion gates from docs/onboarding/PHASE2_BASELINE.md as implemented by the current post-WP-5b lib.evaluation.check_promotion_gates"
    ],
    "additional_criteria": [
      "Plan file EXP-0011 is authored and validated before the H-004 re-execution begins",
      "The run uses the exact registered H-004 baseline parameters and committed H-004 signal logic",
      "The run appends exactly one new generated trial entry to research/trial_log.jsonl",
      "The resulting report references the actual generated trial_id and actual current-run metrics",
      "Historical retrospective H-004 artifacts EXP-0005 and REP-0005 remain unchanged alongside the new forward-flow pair",
      "No candidate registration, data procurement, schema, validator, query-layer, test, runtime, or promotion change occurs"
    ]
  },
  "evaluation_window": {
    "in_sample": {
      "start": null,
      "end": null
    },
    "out_of_sample": {
      "start": null,
      "end": null
    }
  },
  "parameters": {
    "fast_ma": 50,
    "slow_ma": 200,
    "rv_lookback": 30,
    "rv_percentile": 50,
    "taker_fee_bps": 4.0,
    "maker_fee_bps": 2.0,
    "slippage_bps": 2.0,
    "initial_equity": 10000.0,
    "execution": "next_bar_open",
    "primary_timeframe": "1d"
  },
  "data_requirements": [
    "BTCUSDT 1d OHLCV full-history dataset: data/processed/binance_um_perp_BTCUSDT_1d_2020-01-01_2026-04-11_2026-04-12T1655Z.parquet",
    "BTCUSDT funding-rate full-history dataset for funding cashflows: data/processed/binance_um_perp_BTCUSDT_funding_8h_2019-09-10_2026-04-12_2026-04-12T1655Z.parquet",
    "Dataset identifiers used for hashing: binance_um_perp_BTCUSDT_1d_2020-01-01_2026-04-11_2026-04-12T1655Z and binance_um_perp_BTCUSDT_funding_8h_2019-09-10_2026-04-12_2026-04-12T1655Z",
    "No separate IS/OOS split convention is introduced by this package; full-period Sharpe is recorded in both trial-log Sharpe fields per the existing baseline pattern"
  ],
  "pre_registration_date": "2026-04-19",
  "author": "WP-6h forward-flow package",
  "human_approval_required": false
}
